{
  "publicationId": "11111111-1111-4111-8111-111111111111",
  "publishedAt": "2026-07-16T13:00:00Z",
  "actorId": "user:publisher@example.com",
  "approverIds": [
    "user:trust-reviewer@example.com"
  ],
  "sourceVersions": {
    "llm-wiki-trust": "2026.07.16.1",
    "llm-wiki-package-readiness": "2026.07.16.1"
  },
  "items": [
    {
      "entityId": "22222222-2222-4222-8222-222222222222",
      "versionId": "33333333-3333-4333-8333-333333333333",
      "previousVersionId": null
    }
  ],
  "affectedRoutes": [
    "/verify-jvto",
    "/"
  ],
  "validation": {
    "passed": true,
    "errors": [],
    "warnings": []
  }
}